titles,category
       데일리안 퇴근길뉴스  청담동 술자리  결국 거짓말 첼리스트  그 시간 그 술집에 있지도 않았다 등,Politics
한동훈의 반격 김의겸에  사과할 필요 없고 법적 책임 져라 ,Politics
 극한직업  주호영 원내대표   사안마다 대통령실 윤핵관  딴죽 ,Politics
한동훈  저질 음모론 부추긴 이재명 사과하라   김의겸  법적 책임져야 ,Politics
태세전환 황교익  청담동 가짜뉴스  사과해야 ,Politics
  당권경쟁 구도 짜기  친윤계 김기현 나경원 안철수 로키 연대 속 유승민 정중동,Politics
    진    월  일 입대  아미들  혼잡하니 훈련소 오지 마세요 ,Politics
 청담동 술자리 거짓말 에 김의겸  유감  한동훈  법적책임 묻겠다  종합 ,Politics
가세연  조국 딸 포르쉐 탄다 허위 사실 인식 없었어  혐의 부인,Politics
김의겸에 법적책임 묻겠단 한동훈  이제 책임질 시간 ,Politics
박지현  김의겸 대변인 사퇴해야 유감으로 끝날 일 아냐 ,Politics
   이재명은 거대한 검은 코끼리    끄집어내야  종합 ,Politics
청담동 술자리 제보자 거짓말 드러나자 김의겸  유감이다 ,Politics
소식통      영상 보면 최고 사형 경고 공개비판 모임 개최 ,Politics
 천치바보 서울 과녁   김여정의 말폭탄 정부  개탄 ,Politics
 술자리 의혹  접은 김의겸   대통령에 심심한 유감 ,Politics
 바이든 선글라스  끼고 전투기 전차 둘러본   수출 적극 지원할 것 ,Politics
한동훈   저질 음모론  올라탄 이재명 사과하라  김의겸은 법적 책임 ,Politics
 국방부를 방위산업부 라고 했던  대통령 방산  대 수출강국 선언,Politics
한동훈  김의겸 의원  저한테 사과하는 건 모양 빠져서 싫나   국민들께 사죄해야 ,Politics
권성동  악의적 음모론에 중독된    또 사고칠 것 ,Politics
 속보 한동훈  술자리 의혹 제기 김의겸에  사과 필요없고 법적 책임 묻겠다 ,Politics
사우디와  네옴시티 부산엑스포 맞교환설  일축한 박진 장관  둘 다 하는 게 최상 ,Politics
박지현   청담동 술자리 의혹  제기 김의겸  대변인 사퇴해라 ,Politics
유인태  유동규 중용한 사람 누구  사과해야  이재명에 일갈,Politics
박지현  김의겸 사퇴해야 극성 팬덤 자양분 삼은 혐오정치 ,Politics
한동훈  저질음모론 부추긴 이재명 등 사과하라 김의겸 법적 책임져야 ,Politics
 국조에 대검이 왜 들어가    하루종일 들썩인 국민의힘,Politics
 카타르 월드컵 은  대통령 지지율을 끌어올릴 수 있을까,Politics
이재명 거세지는  사법리스크  에 민주당  입장 표명해야  목소리도,Politics
  리포트   천치바보 정권 보고만 있나  반정부 투쟁 선동,Politics
      논란으로 소환된  년 전 이재명 인터뷰  이슈묍 ,Politics
한동훈  저질 음모론 부추긴 이재명 등은 사과해야 ,Politics
 김여정  막말  담화에 한덕수  최소한 예의도 지키지 않아  대단히 유감 ,Politics
조정훈  이태원 참사 국조 반대  세월호 시즌    될 것 ,Politics
윤 대통령  국정과제인 엑스포를 다른 것과 바꿔 먹는 게 말 되나 ,Politics
김의겸  그날로 되돌아간다 해도 다시 같은 질문할 것 ,Politics
 검찰 로비 받았나      대검은 빼자   국정조사 시작부터  삐걱   이슈  ,Politics
  김여정  서울이 과녁  위협  정부  도적이 매질  역공,Politics
 서울 과녁    윤엔 막말 비난 김여정   정부  도둑이 매 드는 격 ,Politics
주호영  대검 국조는 마약수사 한해서만 만족스럽진 않지만 합의 ,Politics
 영상  한동훈  파도 물러났고 김의겸  법적 책임지면 돼 ,Politics
   수출전략 첫 현장은 방산  게임체인저급 무기 개발하자 ,Politics
 돈줄  해킹  건들자  외교부 것들   급  낮춰 발끈한 김여정,Politics
   이재명 가족 계좌 추적 영장 망신주기 의도 뻔해 ,Politics
한동훈  술자리 거짓말  진술에  저질음모론 부추긴 이재명 사과를 ,Politics
김만배  천화동인  호 실소유주는 바로 나  발언 유효할까,Politics
꿈틀거리는 당권레이스   공부모임  새미래        다 모였다,Politics
한동훈  김의겸 사과할 필요 없다  이번엔 법적 책임 물을 것 ,Politics
 아니면 말고   김의겸  유감  표명에 국민의힘 징계 사퇴 요구,Politics
황교익   청담동 술자리 의혹  보도 매체  사실 왜곡은 아니야 ,Politics
 한동훈 청문회 헛발질 보라     이태원 국정조사  믿는 구석,Politics
정진상 구속적부심  기각      진실의 시간  이재명으로 직진 ,Politics
  난 이재명과 정치공동체다  정청래 지지자들  방탄 캠페인,Politics
 최측근  정진상  구속적부심 기각 이재명에 쏠리는   의 눈,Politics
   의총서 대검 국조 대상  마약수서  부서로 한정,Politics
 이태원 국조 계획서  본회의 통과 대검은 마약전담부서만,Politics
 한반도의 오늘   열일 하는 조선우표사 체제선전 위해 올해 우표 발행 급증,Politics
 청담동 술자리 의혹  제기 김의겸    등에 유감       사퇴하라 ,Politics
 김의겸이 또 김의겸했다  민주당 덮친  거짓말 리스크 ,Politics
전투기부터 전차까지 챙긴  대통령  다른 수출과 차원 달라 ,Politics
한동훈  이재명 박찬대 장경태 사과해야 김의겸은 법적 책임 물을 것 ,Politics
 여의도 번지  국정조사 특위 첫 회의부터 불발 대검 포함 여부 충돌,Politics
김의겸  아니면 말고 식 폭로  확인되자 정치권  문책해야  맹폭,Politics
 년전  언론징벌법  띄웠던        엄호 위해  방송법  띄웠다,Politics
 당권경쟁 불붙나       연대설 에 친윤모임도 곧 출범,Politics
김종민  이재명  방탄정당  되면 오히려   정권에 보조 맞추는 것 ,Politics
 사과냐  유감표명이냐  상황설명이냐  이재명 측 거세지는 압박에  고심 ,Politics
 여의도 사사건건  남북관계 악화일로에 장성철  민주당은 위장평화 세력  김성회     년 평화 소중함  이제부터 알게될 것 ,Politics
   이재명 압박  당당하면 수사 협조    대표직 결단하라  종합 ,Politics
    제 노조       편파보도  꼬집으며 이재명  인터뷰 커트  논란 재소환,Politics
    김일성 휘장  시신  주째 무시 통일부  오늘까지 ,Politics
   첫 방산수출전략회의 주재    첨단산업 견인 중추   정부가 적극 지원  종합 ,Politics
고양시  테슬라 아시아 호  기가팩토리  유치 추진,Politics
    청담동 술자리 의혹  김의겸에  거짓말 제조기 사퇴가 사죄 ,Politics
 자막뉴스     무슨 제안했길래   한국  콕  집은 일론 머스크,Politics
정진석  김의겸 향해    지도부는  지라시 생산자 로 전락 ,Politics
김여정  서울이 과녁      년전  서울 불바다 보다 수위 높아졌다,Politics
이재명 측근 정진상  구속적부심 기각,Politics
김여정  윤석열 천치바보  담화에 통일부  국가원수에 저급한 막말 ,Politics
김의겸   청담동 술자리 거짓  진술에  대통령께 심심한 유감 ,Politics
 해군 신형고속정   척    중공업 수주     억원 건조 계약,Politics
화물연대 파업에    정치투쟁일뿐 민주노총 본질은 종북 반미단체 ,Politics
민주  이재명 자택 현금 출처 의혹에  악의적 주장  반박,Politics
장갑차에 적은  세계 시장 석권    대통령  방산 수출 필수 ,Politics
조원진    김여정  사실상 윤석열 퇴진 촛불 지령 내린 셈 ,Politics
민주당 인사들  이재명  최측근 구속 관련 입장표명해야 ,Politics
윤상현  이재명  그만 내려와라 민주당도   떠나보낼 때 ,Politics
조원진    김여정  사실상 윤석열 퇴진 촛불 지령내린 셈 ,Politics
미 인태사령부 전략핵추진잠수함 위치 공개   대북 대중 경고 메시지,Politics
 나혼산  비판한 나경원   고딩엄빠  같은 프로그램은 저출산 극복에 도움 ,Politics
       탈바꿈은 민영화       방송법 개정  언론계 숙원 ,Politics
이태원 참사 국정조사  국민의힘  대검은 빼라 에 초장부터 난항,Politics
 이앤피   이변 속출 카타르 월드컵  한국 우루과이     또는     기대 ,Politics
   용산발 국정조사 비상  지도부 만난 이진복 비공개 의총,Politics
 정조대왕급  이지스구축함  번함 건조 사업  현대중공업 단독 입찰,Politics
 사실이라면  조건 단 김의겸  한동훈 빼놓고   사과  대신  유감 ,Politics
   서해 피격  서훈 소환    박지원 전 국정원장 조사도 초읽기,Politics
   석 병참기지였는데   리스크 에 민주  수난,Politics
 뉴스외전 포커스  최재성  대통령에 대한  천공 의 영향력을 의심할 수밖에 ,Politics
정진석    지도부  지라시 뉴스 생산자 전락 ,Politics
화물연대 총파업에    대국민 협박     정부가 서슬퍼런 말로 윽박 ,Politics
 이재명 태도에 불만   사과해야  민주당 원로 유인태  직격탄 ,Politics
  방산      년까지 세계시장    점유한다,Politics
   남북회담서 벤츠 탄  은 부끄러운 대통령인가   의전차량 지적 일축,Politics
자충수 된  청담동 술자리    그간 민주당 발언 보니,Politics
김여정 담화에 대통령실 대신 통일부 나선 이유  저급하고 예의 없어 ,Politics
       부국장      정상각도 로      시험발사할 가능성 높아 ,Politics
 더뉴스   술자리 의혹  김의겸  윤 대통령 등에 유감         사퇴해야 ,Politics
김도읍  국조  대검  포함에  번복 아냐   무관 확인되면 수정해야 ,Politics
청담동 술자리 없었다 국민의힘  김의겸은  거짓말 자판기  민주는  더불어거짓당  ,Politics
공영방송 지배구조    당론 필요        신속 결론 ,Politics
민노총 총파업 때린    물류 볼모잡은  안전운임제   화물차 사고와 운임비만 늘었다 ,Politics
홍준표 대구시장     묘지 참배 취소에도 오월단체  어디든 따라갈 것 ,Politics
한 총리  국조 증인 출석할 것 화물연대 운송거부  대단히 유감 ,Politics
 한동훈 청담동 술자리  허위 판명   김의겸  반성은 없었다,Politics
 이재명 최측근  정진상 적부심 기각 구속 유지,Politics
 속보   이재명 최측근  정진상 적부심 기각 구속 유지,Politics
 속보   이재명 최측근  정진상 적부심 기각 구속 유지,Politics
통일부   막말 비난  김여정에  개탄스러워 도적이 매 드는 식 ,Politics
 속보   이재명 최측근  정진상 적부심 기각 구속 유지,Politics
통일부   막말 비난  김여정에  개탄스러워 도적이 매 드는 식 ,Politics
안철수  이재명  스스로 대표직 내려놓는 게 정치의 상식 ,Politics
방산수출전략회의 주재한  대통령  기술패권 경쟁 시대  게임체인저급 무기체계 개발해야 ,Politics
 이슈   김여정  대남 막말 비난 통일부  매우 개탄 ,Politics
당심 고삐 당기는 김기현 공부모임서  세  보이고     날 세우기,Politics
 자막뉴스  막말 비난 쏟아낸 김여정    남남갈등 조장까지,Politics
여야  과방위 소위서  방송법 개정  또다시 원점    당론 정해 다시 논의 종합 ,Politics
    억원 이상 안돼     문턱효과 우려  다주택 종부세 공제기준 이견,Politics
  방산      년까지 세계 점유율    목표 민관군 합동 전략회의,Politics
 적대적 언론관  주류와 거리 두는 안철수 당권 경쟁 시작되나,Politics
안철수  이재명은  검은코끼리  당대표직 내려놔야 ,Politics
원희룡  화물연대 집단운송거부 경제 회복 바라는 국민 열망 무시하는 것   뉴시스    ,Politics
   총파업은  정권퇴진  운동 대국민 폭거 ,Politics
    청담동 술자리  새빨간 거짓말로 김의겸  사퇴해야 ,Politics
   퇴진 집회  황운하      검찰개혁  제대로 못한 혹독한 대가 치르고 있어 ,Politics
   한동훈 청담동 술자리 의혹  첼리스트   거짓말했다  진술 경찰  허위 사실 유포 경위 수사,Politics
박진   사우디 네옴시티 부산엑스포 빅딜설 에  사실 아냐 ,Politics
  김여정 또 말폭탄     방관  속 추가 도발 임박했나,Politics
   카타르 월드컵 녹화중계     정국 개막식 공연은 빼먹어,Politics
가까스로 설득한 주호영     마약만 조사 로 합의  이태원 압사 참사 ,Politics
김여정  윤대통령 향해 막말 비난 통일부  매우 개탄 ,Politics
   한동훈 술자리 의혹 은 거짓말  정진석  녹음 폭로된 첼리스트  얼마나 괴로웠을까 ,Politics
한동훈은 빼놓고   사실이라면  조건 달고    김의겸의  이상한 유감 ,Politics
합의 하루만에  대검찰청 제외  요구하며 입장 바꾼 국민의힘 영상 ,Politics
 이앤피         정상회의 때 현대차 대신 벤츠 탔다는 현지언론 보도   ,Politics
청담동 술자리는 없었다   첼리스트  거짓말  진술,Politics
안철수  이재명은  검은 코끼리    한국 정치에서 끄집어내야 ,Politics
 당권주자  나경원  김기현 모임  새미래 서 강연 연대설  솔솔 ,Politics
첼리스트 전 남친  권익위에  술자리 물증  안 냈다 공익신고자 안 될 듯,Politics
      방산  드라이브  세계  대 방산 수출 강국 도약 범정부 수출지원 ,Politics
 술자리 의혹 제기  김의겸  그날로 되돌아간다 해도 같은 질문할 것 ,Politics
검찰  이재명 김혜경 계좌 등 추적중  김용 정진상 대장동 돈 관련 ,Politics
 투기 의혹  서경석 전북개발공사 사장 사직 전북 떠나 종합 보 ,Politics
이재명  사법리스크  점화       사태  약식회견 중단  민심은  데일리안 여론조사 영상 ,Politics
 국조 대상서 대통령실 빠졌다 에 이진복  뭐가 많이 빠졌냐 ,Politics
추가 제재론 나오니   김여정   서울   타격  막말,Politics
  핵잠수함  토마호크    발 탑재      근해서 작전 수행,Politics
엑스포 내주고  네옴  따냈다  박진    사우디 빅딜설에  사실 아니다 ,Politics
김의겸   술자리 제보자 거짓말 진술 에  윤 대통령에 심심한 유감 ,Politics
엑스포 내주고  네옴  따냈다  박진    사우디 빅딜설에  사실 아니다 ,Politics
김의겸   술자리 제보자 거짓말 진술 에  윤 대통령에 심심한 유감 ,Politics
안철수  거대한 검은 코끼리  이재명   이젠 몰아내야 이대로 둘 수 없다 ,Politics
 이재명 자택서  억대 현금  들고 나왔다   민주  악의적 주장 ,Politics
정진석  민주당 지도부  지라시 뉴스  생산   사생활 까발려진 한 여인 울고 있다 ,Politics
 이재명 방탄당  이러다 제 의 조국사태 된다  커지는   위기감,Politics
 이태원 국조  시작부터 삐걱      대검은 빼자  회의 불참,Politics
 청담동 술자리 다 거짓말 남친 속이려한 것    첼리스트  경찰에 진술,Politics
유인태     멘토 조언에도  인간 자체가 싫다 며 이재명 안 만나 ,Politics
유인태  이재명 직격  유동규 중용한 사람 누군가      사과해야 ,Politics
 뉴스        이태원 참사 국조  첫날부터 삐걱     대검 빼달라     합의된 사항 ,Politics
안철수  이재명  스스로 대표직 내려놓는 게 정치의 상식 ,Politics
정진석  김의겸 민주당에 사생활 까발려진 한 여인이 울고 있다 ,Politics
유상범  김의겸  청담동 술자리 의혹  유감표명 진정성 없는 말장난 ,Politics
군  김여정 담화에  동의할 사람 아무도 없을 것 ,Politics
 뉴스앤이슈    일간  이태원 국정조사     본격 조사는 예산안 처리 후 착수,Politics
  이태원 국조위원들  어제 합의  어떻게 깨나   로비 의심 ,Politics
   대검 안 돼        합의 파기  이태원 국조 첫날부터 파행 종합 ,Politics
이재명 위기에 목소리 높이는 비명계      목표   제거 아냐  방탄정당 만드는 것 ,Politics
 영상  민주 과방위원들      민영화  아직 끝난 게 아니다 ,Politics
정진석  엉터리 청담동 제보  주옥같던 민주 지도부 폭로전 여성 사생활에도 폭력 ,Politics
 뉴스킹    국정지지율   김준일     와 싸움만 남아   배종찬  정치적 개기일식 현상 ,Politics
안철수  이재명은  검은 코끼리    민주당 아무 일 못해 ,Politics
   국조 대상에 대검 빼달라  요구에 국조특위 첫 회의 파행,Politics
김여정  윤대통령 향해 막말 비난 통일부  매우 개탄 ,Politics
안철수  이재명  대한민국 근본 흔들고 훼손 스스로 대표직 내려놔야 ,Politics
태영호  김여정 막말 담화로  국민 이간질 넘어가면 안돼 ,Politics
황교익도  청담동 가짜뉴스  더탐사 직격  변명 여지 없어  거짓말  사과해야 ,Politics
 대통령  전투기 공장서  방산수출전략회의   미래 중추 ,Politics
황교익   청담동 술자리 의혹  보도 매체  거짓 중계 사과해야 ,Politics
 서울 과녁  김여정 겁박에 국힘  평화사기쇼 문재인  왜 항변 않나  ,Politics
암호화폐 등 독자 제재 논의에    격한  반응  왜 ,Politics
김여정  천치바보 정권  막말 공세 정부  개탄  강한 유감 ,Politics
    이재명 수사 공식화 에  민주당 뒤 숨지 말고 협조  압박,Politics
조응천  이재명  정치적 책임에 유감 표명해야 사실관계에 당 직접 대응  불편 ,Politics
최연혜 가스  사장 내정에    낙하산     공사 적자해결 ,Politics
통일부  김여정  막말  담화에  도적이 매를 드는 식 매우 개탄  종합 ,Politics
유인태     멘토 조언에도  이재명 싫다 며 안 만나 ,Politics
김기현 공부모임에  나경원 강연하고  안철수도 참석,Politics
윤석열 대통령 문제적 발언부터 해명까지    시간  전말은,Politics
